id,name,category,name_japanese,hero_name,hero_name_japanese,other_names,quirk,quirk_japanese,quirk_description,hero_school,class,affiliation,civilian_description,type,image_path,full_image_path,,,,,
129,Tensei Ida,Heroes,飯田 天晴,Ingenium,インゲニウム,,Engine,エンジン,Allows him to release propulsion jets from his elbows and shoot himself forward at turbo speed.,,,Other - Tenya's older brother and a former Pro Hero,,,images/characters/character_129.png,https://github.com/FigmentAnalytics/my-hero-academia-dashboard/blob/main/images/characters/character_129.png?raw=true,,,,,
130,Juzo Moashi,Heroes,百足 従造,Centipeder,センチピーダー,,Centipede,ムカデ,Grants him long centipede-like limbs with agonizing poison.,,,Other - Nighteye Agency member,,,images/characters/character_130.png,https://github.com/FigmentAnalytics/my-hero-academia-dashboard/blob/main/images/characters/character_130.png?raw=true,,,,,
131,Kaoruko Awata,Heroes,泡田 薫子,Bubble Girl,バブルガール,,Bubble,バブル,Allows her to make bubbles filled with an aroma that she has smelled at least once before.,,,Other - Nighteye Agency member,,,images/characters/character_131.png,https://github.com/FigmentAnalytics/my-hero-academia-dashboard/blob/main/images/characters/character_131.png?raw=true,,,,,
132,Sajin Higawara,Heroes,日河原砂塵,Sand Hero Snatch,サンドヒーロー スナッチ,,Unnamed,,Enables him to turn the upper half of his body into sand and control it,,,Other - Pro Hero and a bodyguard of the Police Force,,,images/characters/character_132.png,https://github.com/FigmentAnalytics/my-hero-academia-dashboard/blob/main/images/characters/character_132.png?raw=true,,,,,
133,Moe Kamiji,Heroes,上路 萌,Burnin,バーニン,,Blazing Hair,燃髪,Allows her to weaponize her fire-like hair.,,,Other - Pro Hero and one of over thirty sidekicks who work at the Endeavor Agency,,,images/characters/character_133.png,https://github.com/FigmentAnalytics/my-hero-academia-dashboard/blob/main/images/characters/character_133.png?raw=true,,,,,
147,Inko Midoriya,Other,緑谷 引子,,,,,,,,,,Izuku's mother. She has an unnamed quirk that allows her to draw small objects to her with telekinesis-like power.,Civilian,images/characters/character_147.png,https://github.com/FigmentAnalytics/my-hero-academia-dashboard/blob/main/images/characters/character_147.png?raw=true,,,,,
148,Kota Izumi,Other,出水 洸汰,,,,,,,,,,A young boy who lost his Hero parents the Water Hose duo to Muscular and was taken in by the Pussycats due to Mandalay being his aunt. His Quirk 'Water Gun' allows him to release a splash of water from his hands.,Civilian,images/characters/character_148.png,https://github.com/FigmentAnalytics/my-hero-academia-dashboard/blob/main/images/characters/character_148.png?raw=true,,,,,
149,Taneo Tokuda,Other,特田 種男,,,,,,,,,,A freelance journalist who sought out All Might's successor for personal reasons. His Quirk 'Whole-Body Lens' allows him to manifest camera lenses on any part of his body and print the photographs from his chest.,Civilian,images/characters/character_149.png,https://github.com/FigmentAnalytics/my-hero-academia-dashboard/blob/main/images/characters/character_149.png?raw=true,,,,,
150,Eri,Other,エリ,,,,,,,,,,"The young granddaughter of the Shie Hassaikai's former crime boss. Her Quirk 'Rewind' enables her to reverse a living individual's body back to a previous state, allowing her to make them younger, heal them of their injuries, and undo any of their bodily modifications.",Civilian,images/characters/character_150.png,https://github.com/FigmentAnalytics/my-hero-academia-dashboard/blob/main/images/characters/character_150.png?raw=true,,,,,
151,Rei Todoroki,Other,轟 冷,,,,,,,,,,Endeavor's wife and the mother of their four children. She has a powerful ice Quirk that has yet to be shown.,Civilian,images/characters/character_151.png,https://github.com/FigmentAnalytics/my-hero-academia-dashboard/blob/main/images/characters/character_151.png?raw=true,,,,,
152,Fuyumi Todoroki,Other,轟 冬美,,,,,,,,,,Shoto's older sister. She works as an elementary school teacher and has an ice Quirk like her mother.,Civilian,images/characters/character_152.png,https://github.com/FigmentAnalytics/my-hero-academia-dashboard/blob/main/images/characters/character_152.png?raw=true,,,,,
154,Natsuo Todoroki,Other,轟 夏雄,,,,,,,,,,Shoto's older brother. He is a university student majoring in medicine and has an ice Quirk like his mother.,Civilian,images/characters/character_154.png,https://github.com/FigmentAnalytics/my-hero-academia-dashboard/blob/main/images/characters/character_154.png?raw=true,,,,,
155,Hiroshi Tameda,Other,為田 浩,,,,,,,,,,"Endeavor's loyal fan. Hiroshi is rather supportive of Endeavor, notably when he spoke out to the public that they still need to believe in Endeavor for protecting society from powerful villains like High-End.",Civilian,images/characters/character_155.png,https://github.com/FigmentAnalytics/my-hero-academia-dashboard/blob/main/images/characters/character_155.png?raw=true,,,,,
156,David Shield,Other,デヴィット・シールド,,,,,,,,,,"David Shield is a scientist at I-Island, All Might's old friend, and the father of Melissa Shield.",Civilian,images/characters/character_156.png,https://github.com/FigmentAnalytics/my-hero-academia-dashboard/blob/main/images/characters/character_156.png?raw=true,,,,,
157,Melissa Shield,Other,メリッサ・シールド,,,,,,,,,,Melissa is the Quirkless daughter of David Shield.,Civilian,images/characters/character_157.png,https://github.com/FigmentAnalytics/my-hero-academia-dashboard/blob/main/images/characters/character_157.png?raw=true,,,,,
158,Katsuma Shimano,Other,島乃 活真,,,,,,,,,,"A little boy living on Nabu Island. His Quirk 'Cell Activation' allows its user to activate the cells in anyone's body through touch which increases regeneration, recovery time, and improves their physical condition.",Civilian,images/characters/character_158.png,https://github.com/FigmentAnalytics/my-hero-academia-dashboard/blob/main/images/characters/character_158.png?raw=true,,,,,
159,Mahoro Shimano,Other,島乃 真幌,,,,,,,,,,A little girl living on Nabu Island who is Katsuma's older sister. Her Quirk 'Hologram' allows her to create holograms of anything she wishes.,Civilian,images/characters/character_159.png,https://github.com/FigmentAnalytics/my-hero-academia-dashboard/blob/main/images/characters/character_159.png?raw=true,,,,,
160,Rody Soul,Other,ロディ ソウル,,,,,,,,,,"His Quirk 'Soul' manifests as a small, bird-like animal named Pino, who changes facial expressions based on how Rody is feeling due to a link to his soul. Rody is also a resident of Otheon.",Civilian,images/characters/character_160.png,https://github.com/FigmentAnalytics/my-hero-academia-dashboard/blob/main/images/characters/character_160.png?raw=true,,,,,
161,Pino,Other,ピノ,,,,,,,,,,"A small, bird-like animal who changes facial expressions based on how Rody is feeling due to a link to his soul.",Civilian,images/characters/character_161.png,https://github.com/FigmentAnalytics/my-hero-academia-dashboard/blob/main/images/characters/character_161.png?raw=true,,,,,
